ID EVENT uniek	E_aantal keer vermeld	Titel	DATUM KRANT	Onderwerp	Thema's_categorie	city	country	continent	spreker_samengevoegd	organisator1_gestandaardiseerd	Locatie	Locatie_gestandaardiseerd	STAD STANDAARD_GEGROEPEERD	period
EID7416	1.0	Le Peuple	1924-11-13 00:00:00	L'architecture et la sculpture en France pendant la Révolution et l'Empire	kunst		Frankrijk	Europa	VitryEugène Paul	Institut des Hautes Etudes de Belgique		Institut des Hautes Etudes de Belgique	Brussel	1922-1924
EID7417	1.0	Le Peuple	1924-11-13 00:00:00	Histoire de l'art russe (6 leçons)	kunst		Rusland	Europa	EckAlexandre	Institut des Hautes Etudes de Belgique		Institut des Hautes Etudes de Belgique	Brussel	1922-1924
EID7424	1.0	Le Peuple	1924-11-13 00:00:00	L'architecture et la sculpture en France pendant la Restauration et la Monarchie de juillet 	kunst		Frankrijk	Europa	VitryEugène Paul	Institut des Hautes Etudes de Belgique		Institut des Hautes Etudes de Belgique	Brussel	1922-1924
EID7473	1.0	Le Peuple	1924-11-19 00:00:00	Histoire de l'art russe (6 leçons)	kunst		Rusland	Europa	EckAlexandre	Institut des Hautes Etudes de Belgique		Institut des Hautes Etudes de Belgique	Brussel	1922-1924
EID7505	1.0	Le Peuple	1924-11-24 00:00:00	Eléments d'archéologie égyptienne (environ 10 leçons)	geschiedenis		Egypte	Afrika	SpeleersLouis	Institut des Hautes Etudes de Belgique		Institut des Hautes Etudes de Belgique	Brussel	1922-1924
EID7519	1.0	Le Peuple	1924-11-26 00:00:00	La sculpture en Chine (environ 10 leçons)	kunst		China	Azië	HentzeCarolus Philippus	Institut des Hautes Etudes de Belgique		Institut des Hautes Etudes de Belgique	Brussel	1922-1924
EID7527	1.0	Le Peuple	1924-11-26 00:00:00	Histoire de l'art russe (6 leçons)	kunst		Rusland	Europa	EckAlexandre	Institut des Hautes Etudes de Belgique		Institut des Hautes Etudes de Belgique	Brussel	1922-1924
EID7588	1.0	Le Peuple	1924-12-03 00:00:00	Histoire de l'art russe (6 leçons)	kunst		Rusland	Europa	EckAlexandre	Institut des Hautes Etudes de Belgique		Institut des Hautes Etudes de Belgique	Brussel	1922-1924
EID7618	1.0	Le Peuple	1924-12-09 00:00:00	Eléments d'archéologie égyptienne (environ 10 leçons)	geschiedenis		Egypte	Afrika	SpeleersLouis	Institut des Hautes Etudes de Belgique		Institut des Hautes Etudes de Belgique	Brussel	1922-1924
EID7629	1.0	Le Peuple	1924-12-11 00:00:00	La Chine et le Japon au point de vue archéologique: la sculpture en Chine (environ dix leçons)	geschiedenis		China	Azië	HentzeCarolus Philippus	Institut des Hautes Etudes de Belgique		Institut des Hautes Etudes de Belgique	Brussel	1922-1924
EID7646	1.0	Le Peuple	1924-12-12 00:00:00	Histoire de l'art russe (dernière leçon)	kunst		Rusland	Europa	EckAlexandre	Institut des Hautes Etudes de Belgique		Institut des Hautes Etudes de Belgique	Brussel	1922-1924
EID8154	1.0	Le Peuple	1924-12-20 00:00:00	Le Kassaï	travel		Congo	Afrika	Cayen	Institut des Hautes Etudes de Belgique		Institut des Hautes Etudes de Belgique	Brussel	1922-1924
EID8184	1.0	Le Peuple	1923-01-28 00:00:00	Un voyage au Cambodge	travel		Cambodja	Azië	de Goloubeff	Institut des Hautes Etudes de Belgique				1922-1924
EID8357	1.0	Le Peuple	1922-11-17 00:00:00	L'Asie antérieure	travel			Azië	SpeleersLouis	Institut des Hautes Etudes de Belgique		Institut des Hautes Etudes de Belgique	Brussel	1922-1924
EID8361	1.0	Le Peuple	1923-12-05 00:00:00	Le Sahara	travel			Afrika	Surcouf	Institut des Hautes Etudes de Belgique		Institut des Hautes Etudes de Belgique	Brussel	1922-1924
EID8406	1.0	Le Peuple	1923-11-05 00:00:00	"la sculpture et de l'architecture en France à l'époque de la Renaissance"""	kunst		Frankrijk	Europa	VitryEugène Paul	Institut des Hautes Etudes de Belgique		Institut des Hautes Etudes de Belgique	Brussel	1922-1924
E3	0.0	Le Peuple	1923-05-02 00:00:00	L'art bouddhique de l'Insulinde	kunst			Azië	HackinJ.	Institut des Hautes Etudes de Belgique		Institut des Hautes Etudes de Belgique	Brussel	1922-1924
EID5405	2.0	L'Indépendance Belge	1923-04-08 00:00:00	La Mission belge au Ruanda 	maatschappelijk		Ruanda	Afrika	AnetH. 	Institut métapychique	Au Foyer	Institut métapychique	Brussel	1922-1924
EID8381	2.0	Journal De Bruxelles	1914-02-28 00:00:00	Sienne	travel	Siena	Italië	Europa	Van den HeuvelJules	Institut St-Thomas	Institut St-Thomas		Rest	1914-1918
EID5313	1.0	Journal De Bruxelles	1923-03-19 00:00:00	Les tombes des Pharaons	geschiedenis		Egypte	Afrika	Van den HeuvelJules	Institut superieur de Philosophie	Institut superieur de Philosophie		Rest	1922-1924
EID1996	2.0	Journal De Bruxelles	1914-01-26 00:00:00	l'art grec sous les successeurs d'Alexandre	kunst		Griekenland	Europa	MayenceF.	Institut Supérieur de Philosophie	Institut Supérieur de Philosophie		Rest	1914-1918
EID2045	2.0	Journal De Bruxelles	1914-02-03 00:00:00	L'architecture civile ancienne en Belgique	kunst		België	Europa	CloquetLouis Martial Adrien Ghislain	Institut Supérieur de Philosophie	Institut Supérieur de Philosophie		Rest	1914-1918
EID2102	2.0	Journal De Bruxelles	1914-02-09 00:00:00	L'architecture civile ancienne en Belgique	kunst		België	Europa	CloquetLouis Martial Adrien Ghislain	Institut Supérieur de Philosophie	Institut Supérieur de Philosophie		Rest	1914-1918
EID2145	2.0	Journal De Bruxelles	1914-02-17 00:00:00	L'architecture civile ancienne en Belgique	kunst		België	Europa	CloquetLouis Martial Adrien Ghislain	Institut Supérieur de Philosophie	Institut Supérieur de Philosophie		Rest	1914-1918
EID4464	1.0	Het Laatste Nieuws	1923-08-15 00:00:00	Gent	travel	Gent	België	Europa	LippensEdgard	Intergeallieerd parlementair Comiteit voor Oorlogsverminkten	Maatschappij voor Aardrijkskunde			1922-1924
EID7822	1.0	De Standaard	1923-08-14 00:00:00	"""Propaganda tot bevordering van het vreemdelingenverkeer"" ""Een van onze stadgenooten heeft zich welwillend belast met propaganda in Spanje's nabuurstaat. Op aanvraag van de Portugeesche afvaardiging van het Intergeallieerd parlementair Comiteit voor Oorlogsverminkten heeft de heer Edgard Lippens, bankier te Gent, een voordracht met lichtbeelden over Gent in de Maatschappij voor Aardrijkskunde van Lissabon gehouden"" ""Deze sprak toen van Gent, de stad der bloemen, de stad der praalgebouwen"""	travel	Gent	België	Europa	LippensEdgard	Intergeallieerd parlementair Comiteit voor Oorlogsverminkten	Maatschappij voor Aardrijkskunde			1922-1924
EID4198	2.0	Journal De Bruxelles	1922-08-02 00:00:00	Le Travail de l'adolescent dans l'industrie américaine	maatschappelijk		Verenigde Staten	Amerika	Van HeckeAlbert Karel Georges	Jeunesse sociale catholique 	Centrale chrétienne du Travail	Centrale chrétienne du Travail	Brussel	1922-1924
EID6437	1.0	Het Nieuws van den Dag	1924-01-19 00:00:00	"""lezing met lichtbeelden over Palestina"""	travel		Palestina	Azië	Levie	Jonge Katholieke Wacht	zaal Patria		Rest	1922-1924
EID7792	1.0	De Standaard	1923-11-18 00:00:00	"""""Pater Damiaan"" (met lichtbeelden)"""	geschiedenis		Hawaï	Amerika	De Meulder	Jonge Katholieke Wacht	Gildenhuis		Rest	1922-1924
EID7807	1.0	De Standaard	1923-11-18 00:00:00	"""""Het Ruhrgebied"" (met lichtbeelden)"""	travel	Ruhrgebied	Duitsland	Europa	Hanssens	Jonge Katholieke Wacht	Gildenhuis		Rest	1922-1924
EID7820	1.0	De Standaard	1923-11-18 00:00:00	"""""Vlaanderen in 1830"" (met lichtbeelden)"""	geschiedenis		België	Europa	LernoJoe	Jonge Katholieke Wacht	Gildenhuis		Rest	1922-1924
EID7826	1.0	De Standaard	1923-11-18 00:00:00	"""""Lourdes"" (met lichtbeelden"""	travel	Lourdes	Frankrijk	Europa	Moernaut	Jonge Katholieke Wacht	Gildenhuis		Rest	1922-1924
EID7833	1.0	De Standaard	1923-11-18 00:00:00	"""""De Kempen "" (met lichtbeelden)"""	travel	Kempen	België	Europa	PrimsFlorentinus Hubertus Ludovicus	Jonge Katholieke Wacht	Gildenhuis		Rest	1922-1924
EID5158	1.0	Het Laatste Nieuws	1923-02-26 00:00:00	"""Italië"""	travel		Italië	Europa	Van KalkenFrans	Jonge Tooneelliefhebbers van Brussel			Brussel	1922-1924
EID7476	2.0	Het Nieuws van den Dag	1924-11-25 00:00:00	"""een belangwekkende voordracht hield met lichtbeelden over Lourdes"""	travel	Lourdes	Frankrijk	Europa	Clarebout	Jongenlingenpatronaat	Patronagezaal		Rest	1922-1924
EID4054	1.0	De Standaard	1922-05-15 00:00:00	"""Voordrachten over Congo-Kolonie"" ""de 3 eerste voordrachten zullen allen vergezeld met lichtbeelden"" ""zijne reis naar Kongoland"""	travel		Congo	Afrika	De CockA. 	Journée Coloniale	"lokaal ""Melomanen"""		Rest	1922-1924
EID4058	1.0	De Standaard	1922-05-15 00:00:00	"""Voordrachten over Congo-Kolonie"" ""de 3 eerste voordrachten zullen allen vergezeld met lichtbeelden"" ""over de toekomst van de Kongo Kolonie"""	travel		Congo	Afrika	DubreucqRené	Journée Coloniale	"lokaal ""Melomanen"""		Rest	1922-1924
EID4070	1.0	De Standaard	1922-05-15 00:00:00	"""Voordrachten over Congo-Kolonie"" ""de 3 eerste voordrachten zullen allen vergezeld met lichtbeelden"" ""vooral bezig houden met Kasaï en Katanga"""	travel		Congo	Afrika	Sande 	Journée Coloniale	"lokaal ""Melomanen"""		Rest	1922-1924
EID4096	1.0	Het Laatste Nieuws	1922-06-16 00:00:00	Over onze kolonie	travel		Congo	Afrika	De BackerJoseph	Journée Coloniale	Eden-Schouwburg		Rest	1922-1924
EID4101	1.0	Het Laatste Nieuws	1922-06-16 00:00:00	Over onze kolonie	travel		Congo	Afrika	De BackerJoseph	Journée Coloniale	Eden-Schouwburg		Rest	1922-1924
EID4110	1.0	Het Laatste Nieuws	1922-06-26 00:00:00	De Wilde Dieren van Afrika	travel			Afrika		Journée Coloniale	feestzaal van den Dierentuin	Dierentuin	Antwerpen	1922-1924
EID4730	2.0	L'Indépendance Belge	1923-01-12 00:00:00	Le Congo géographique et ethnographique	maatschappelijk		Congo	Afrika	De BackerJoseph	Journée Coloniale	l'Ecole n°3	Ecole n°3	Brussel	1922-1924
EID4738	1.0	L'Indépendance Belge	1923-01-12 00:00:00	Le médecin et la médecine au Congo	maatschappelijk		Congo	Afrika	DanielGaston	Journée Coloniale	la salle du Cinéma Palace 	Cinéma Palace	Brussel	1922-1924
EID5347	3.0	Het Laatste Nieuws	1923-03-17 00:00:00	"""Le Congo tel qu'l est aujourd'hui ('Kongo zooals het heden is')"""	travel		Congo	Afrika	DayePierre	Journée Coloniale	zaal van de bioskoop 'Albert-Hall'	Bioskoop 'Albert-Hall'	Brussel	1922-1924
EID5358	3.0	Le Matin	1923-03-21 00:00:00	"""De toekomst van onze kolonie op gebied van handel, nijverheid en landbouw"""	maatschappelijk		Congo	Afrika	SiebenArthur	Journée Coloniale	"""à la salle du ""Café Royal"""""		Rest	1922-1924
EID5442	1.0	De Nieuwe Gazet	1923-04-14 00:00:00	Congo, terre d'énergie	travel		Congo	Afrika	LaudeNorbert	Journée Coloniale	stedelijke feestzaal		Rest	1922-1924
EID5594	2.0	De Nieuwe Gazet	1923-06-19 00:00:00	"""over de kolonie"""	travel		Congo	Afrika		Journée Coloniale	Anvers-Palace	Anvers Palace	Antwerpen	1922-1924
EID5600	3.0	Het Handelsblad	1923-06-27 00:00:00	de diamanten van Congo	maatschappelijk		Congo	Afrika	Lancsweert	Journée Coloniale	groote feestzaal van den Dierentuin	Dierentuin	Antwerpen	1922-1924
EID5604	1.0	Het Nieuws van den Dag	1923-06-30 00:00:00	"""Koloniale dag"" ""voordracht met lichtbeelden"""	maatschappelijk		Congo	Afrika		Journée Coloniale	"groote zaal ""Flora"""		Rest	1922-1924
EID5610	2.0	Het Handelsblad	1923-06-30 00:00:00	Stanley	geschiedenis			Afrika	DierckxVincent	Journée Coloniale	den kinema Minerva		Rest	1922-1924
EID5613	1.0	Het Handelsblad	1923-06-30 00:00:00	onze kolonie	travel		Congo	Afrika		Journée Coloniale	op de hoogte van de Eliaertstraat met zicht naar de Turnhoutschebaan (in open lucht)		Antwerpen	1922-1924
EID5617	1.0	De Nieuwe Gazet	1923-07-06 00:00:00	diamant van Congo	maatschappelijk		Congo	Afrika	SchepmansWillem	Journée Coloniale	schouwburg Anvers-palace	Anvers Palace	Antwerpen	1922-1924
EID6889	1.0	Het Laatste Nieuws	1924-03-17 00:00:00	De koloniale propaganda in 1894 en hedendaagsche, de ekonomische betrekkingen tusschen België en Engeland	maatschappelijk		Congo	Afrika	Dryepondt	Journée Coloniale	Groote feestzaal van het stadshuis		Rest	1922-1924
EID7026	1.0	Journal De Bruxelles	1924-05-08 00:00:00	Ruanda et l'Urundi	travel		Rwanda, Urundi	Afrika	RodigasEdgar Joseph Eugène Alvarez Émile	Journée Coloniale	Vieux Gand		Rest	1922-1924
EID7062	2.0	Le Soir	1924-05-23 00:00:00	"""Le Congo en général"" "	travel		Congo	Afrika	De BackerJoseph	Journée Coloniale	L'école nr. 13	Ecole Communale n°13	Brussel	1922-1924
EID7107	2.0	De Nieuwe Gazet	1924-07-02 00:00:00	Congo, zijn bewoners, zeden en gewoonten	travel		Congo	Afrika	Maes	Journée Coloniale	Nationalen Schouwburg (Salle de Paris). 		Rest	1922-1924
EID7120	1.0	Het Nieuws van den Dag	1924-07-08 00:00:00	"""Het feest, dat allerbest gelukte, sloot met lichtbeelden in open lucht: ""De Zichten op Midden-Afrika"", van den prins van Zweden"""	travel			Afrika		Journée Coloniale	BUITEN		Rest	1922-1924
EID7121	2.0	Het Handelsblad	1924-07-03 00:00:00	De Kongo, zijne bewoners, zeden en gewoonten	travel		Congo	Afrika	Maes	Journée Coloniale	in den Schouwburg, Salle de Paris, Bruel		Rest	1922-1924
EID7475	1.0	Het Nieuws van den Dag	1924-11-20 00:00:00	"""eene voordracht met lichtbeelden"" """"Congoland, zooals ik het gezien heb"""""	travel		Congo	Afrika	Chalux 	Journée Coloniale	zaal van den Bioskoop Albert-Hall	Bioskoop 'Albert-Hall'	Brussel	1922-1924
EID6501	2.0	Het Laatste Nieuws	1924-01-27 00:00:00	De vooruitgang der beschaving in Belgisch Kongo	maatschappelijk		Congo	Afrika	SiebenArthur	Kath. Vl. Burgerbond	Lokaal	Vlaamsche Bond	Brussel	1922-1924
EID6527	1.0	De Standaard	1924-02-07 00:00:00	"""Missieactie"" ""een voordracht met lichtbeelden over Congo"" ""eene reeks prachtige lichtbeelden over het missiewerk der EE. PP. Broeders en Zusters"""	maatschappelijk		Congo	Afrika	Van den BulckeArthur	Kath. Vl. Burgerbond	lokaal der Kath. Burgersbond		Rest	1922-1924
EID7332	1.0	De Standaard	1924-10-23 00:00:00	"""voordracht met lichtbeelden"" ""over ""De Staatskolonie voor krankzinnigen te Gheel"""""	maatschappelijk		België	Europa	LamsensJ. 	Kath. Vl. Burgerbond			Rest	1922-1924
EID7369	1.0	De Standaard	1924-10-23 00:00:00	"""voordracht met lichtbeelden"" ""over ""Armenië"""""	travel		Armenië	Azië	Kerckhove Ladislas	Kath. Vl. Burgerbond			Rest	1922-1924
EID7441	1.0	De Standaard	1924-11-12 00:00:00	"""voordracht"" ""over ""Noord-Italië"" met lichtbeelden en uitvoering van liederen"""	travel		Italië	Europa	De Vis	Kath. Vl. Burgerbond			Rest	1922-1924
EID7536	1.0	De Standaard	1924-11-12 00:00:00	"""voordracht"" ""over ""Armenië en het Heilig Land"", met lichtbeelden"""	travel		Armenië, het Heilige Land	Azië	Kerckhove Ladislas	Kath. Vl. Burgerbond			Rest	1922-1924
EID7795	1.0	De Standaard	1924-08-31 00:00:00	"""'t Noorden van Italië, met lichtbeelden en uitvoering van Italiaansche volksliederen"""	travel		Italië	Europa	De Vis	Kath. Vl. Burgerbond			Rest	1922-1924
EID7797	1.0	De Standaard	1924-08-31 00:00:00	"""Het heilig Land, met lichtbeelden"""	travel		het Heilige Land	Afrika	Decoene Alb. 	Kath. Vl. Burgerbond			Rest	1922-1924
EID1930	2.0	Gazet Van Antwerpen	1914-01-18 00:00:00	de missie van Congo der EE.PP. Capucienen	maatschappelijk		Congo	Afrika	Fulgentius	Katholiek Vlaamsch Verbond	in de gewone zaal hunner feesten, het Jongenspatronaat		Rest	1914-1918
EID3791	1.0	De Standaard	1922-03-17 00:00:00	"""voordracht met lichtbeelden"" """"De Missiën van Molokai"""" ""Eerst kregen we de ligging en aardrijkskundige studie van de streken der missiën; daarna het grootsche zelfopofferende werk van onzen Vlaamschen missionaris Pater Damiaan en vervolgens het vreeselijke der ziekte van melaatschheid"""	geschiedenis		Hawaï	Amerika	Julianus	Katholiek Vlaamsch Verbond	t Zaaltje		Rest	1922-1924
EID4026	1.0	De Standaard	1922-05-04 00:00:00	"""na deze vergadering een feestzitting"" ""Lichtbeelden met voordracht"" ""over het werk van den Ghistelnaar Pater Seghers in Congo; Concert met toneelstuk en kluchtzangen"""	maatschappelijk		Congo	Afrika	Flameygh	Katholiek Vlaamsch Verbond	Gravenhof		Rest	1922-1924
EID4327	1.0	De Standaard	1922-11-16 00:00:00	"""missiewerk in Belgisch Congo"""	maatschappelijk		Congo	Afrika	PauwelsA.	Katholiek Vlaamsch Verbond			Rest	1922-1924
EID6326	1.0	De Standaard	1923-11-25 00:00:00	"""voordracht met lichtbeelden over ""Het Katholicisme in Ierland"""""	maatschappelijk		Ierland	Europa	OallewaertJ.K.	Katholiek Vlaamsch Verbond	Patronage		Rest	1922-1924
EID6804	3.0	Het Handelsblad	1924-02-25 00:00:00	China, Land en Volk	travel		China	Azië	SegersArthur	Katholiek Vlaamsch Verbond	St-Aloysius Patronaat	Sint-Aloysius Patronaat	Antwerpen	1922-1924
EID6917	1.0	De Standaard	1924-04-09 00:00:00	"""een puike voordracht met 100 lichtbeelden over Congo"""	travel		Congo	Afrika	SiebenArthur	Katholiek Vlaamsch Verbond	Zaaltje Katholiek Vlaams Verbond		Rest	1922-1924
EID7292	2.0	Het Handelsblad	1924-10-21 00:00:00	Hongarië, en het zoo nuttige werk der Hongaarse kinderen	maatschappelijk		Hongarije	Europa	PrimsFlorentinus Hubertus Ludovicus	Katholiek Vlaamsch Verbond	de zaal van St-Aloysius Patronaat	Sint-Aloysius Patronaat	Antwerpen	1922-1924
EID8029	1.0	De Standaard	1923-04-06 00:00:00	"""voordrachten met lichtbeelden"" ""Congo"" "	travel		Congo	Afrika		Katholiek Vlaamsch Verbond	"zaal van ""Ons Huis"""		Rest	1922-1924
EID8031	1.0	De Standaard	1923-04-06 00:00:00	"""voordrachten met lichtbeelden"" ""Noorwegen"""	travel		Noorwegen	Europa		Katholiek Vlaamsch Verbond	"zaal van ""Ons Huis"""		Rest	1922-1924
EID8032	1.0	De Standaard	1923-04-06 00:00:00	"""voordrachten met lichtbeelden"" ""Zwitserland en de legende van Willem Tell"""	travel		Zwitserland	Europa		Katholiek Vlaamsch Verbond	"zaal van ""Ons Huis"""		Rest	1922-1924
EID8033	1.0	De Standaard	1923-04-06 00:00:00	"""voordrachten met lichtbeelden"" ""China"""	travel		China	Azië		Katholiek Vlaamsch Verbond	"zaal van ""Ons Huis"""		Rest	1922-1924
EID8034	1.0	De Standaard	1923-04-06 00:00:00	"""voordrachten met lichtbeelden"" ""Venetië"""	travel		Venetië	Europa		Katholiek Vlaamsch Verbond	groote Gildezaal		Rest	1922-1924
EID2939	1.0	Het Vlaamsche Nieuws - Vlaamsche Gazet	1916-03-22 00:00:00	De Vereenigde Staten van Noord-Amerika	travel		Verenigde Staten	Amerika	BoenRobrecht	Katholiek Vlaamsche Kring	"groote zaal van het lokaal ""De Fortuin"""		Rest	1914-1918
EID6532	1.0	Het Handelsblad	1924-02-01 00:00:00	China	travel		China	Azië	SegersArthur	Katholieke Middenstanders in Diamant en Kunstnijverheden	lokaal der vereeniging (zetel Pelikaanstraat, 28?)	Katholieke Middenstanders in Diamant en Kunstnijverheden	Antwerpen	1922-1924
EID2059	1.0	De werking van de katholieke vlaamsche arrondissementsbonden der provincie Antwerpen	1914-01-01 00:00:00	Rome	travel	Rome	Italië	Europa	BelpaireJ. 	Katholieke Vlaamsche Arrondissementsbond			Rest	1914-1918
EID2622	1.0	De werking van de katholieke vlaamsche arrondissementsbonden der provincie Antwerpen	1914-01-01 00:00:00	Rome	travel	Rome	Italië	Europa	BelpaireJ. 	Katholieke Vlaamsche Arrondissementsbond			Rest	1914-1918
EID7802	1.0	De Standaard	1922-05-11 00:00:00	"""Na deze prachtig geslaagde vergadering gaf de plaatselijke afdeeling een puik feest aan zijn leden en aan deze vand en arrondissementsbond. Tooneel, zang en eene boeiende voordracht van Pater Flameigh, die ons met lichtbeelden mee leven deed de reizen en werken van den Ghitelschen Pater Seghers in Congo"""	travel		Congo	Afrika	Flameygh	Katholieke Vlaamsche Arrondissementsbond			Rest	1922-1924
EID5251	1.0	De Standaard	1923-03-23 00:00:00	"""over Rome"""	travel	Rome	Italië	Europa	EnglishMichiel	Katholieke Vlaamsche beweging	Studiekring van de katholieke Vlaamsche beweging Knokke		Rest	1922-1924
EID1213	1.0	Het Handelsblad	1904-02-07 00:00:00	aardrijkskunde en colonisatie van Congo	maatschappelijk		Congo	Afrika	JanssensEdw.	Katholieke Vlaamsche Hoogeschooluitbreiding	zaal Anthonis	zaal Anthonis	Antwerpen	1902-1904
EID1405	1.0	Het Nieuws van den Dag	1904-03-25 00:00:00	"""voordracht met lichtbeelden"" ""over de Hindoesche Kunst"""	kunst			Azië	CombazGisbert Corneel Henri Paul	Katholieke Vlaamsche Hoogeschooluitbreiding	Den Kring Patria	Salle Patria	Brussel	1902-1904
EID1429	1.0	Gazet van Antwerpen	1904-04-05 00:00:00	"""La Corée"" "	travel		Korea	Azië	de BrayA. -J. 	Katholieke Vlaamsche Hoogeschooluitbreiding	zaal van de Broeders der Christelijke Scholen	Broeders der Christelijke Scholen	Antwerpen	1902-1904
EID1899	1.0	Het katholieke volk	1914-01-11 00:00:00	Egyptische beschaving: De manier van begraven	geschiedenis		Egypte	Afrika	FierensJ. 	Katholieke Vlaamsche Hoogeschooluitbreiding	Patria	Patria	Brussel	1914-1918
EID1917	1.0	Het katholieke volk	1914-01-11 00:00:00	In de Arabische woestijn	travel			Afrika	Van TichelenHendrik	Katholieke Vlaamsche Hoogeschooluitbreiding	werkmanskring Ste Barbara	Werkmanskring Sainte-Barbara	Brussel	1914-1918
EID1935	2.0	Het Nieuws van den Dag	1914-01-20 00:00:00	Egyptische beschaving: Huiselijk en godsdienstig leven bij de Egyptenaren 	geschiedenis		Egypte	Afrika	FierensJ. 	Katholieke Vlaamsche Hoogeschooluitbreiding	Patria	Patria	Brussel	1914-1918
EID1969	1.0	Het katholieke volk	1914-01-24 00:00:00	Rome	travel	Rome	Italië	Europa	Bril	Katholieke Vlaamsche Hoogeschooluitbreiding	Davidsfonds	Davidsfonds	Brussel	1914-1918
EID1984	1.0	Het katholieke volk	1914-01-24 00:00:00	Duitsche en Engelse arbeiderswoningen en tuinsteden	maatschappelijk		Duitsland, Engeland	Europa	VerwilghemHubertus Philippus Alphonsus Josephus	Katholieke Vlaamsche Hoogeschooluitbreiding	studiekring	Studiekring	Brussel	1914-1918
EID2026	3.0	Het katholieke volk	1914-02-01 00:00:00	De Gevangene van het Vatikaan	maatschappelijk		Vaticaanstad	Europa	CornelisJ.	Katholieke Vlaamsche Hoogeschooluitbreiding	Patria	Patria	Brussel	1914-1918
EID2047	1.0	Het katholieke volk	1914-02-01 00:00:00	De Slaapziekte	maatschappelijk		Congo	Afrika	Leemans	Katholieke Vlaamsche Hoogeschooluitbreiding	werkmanskring	Werkmanskring 	Brussel	1914-1918
EID2265	5.0	Het Handelsblad	1914-03-04 00:00:00	Wagner en Parsifal	kunst		Duitsland	Europa	PansaersJ. K. 	Katholieke Vlaamsche Hoogeschooluitbreiding	Sint-Jan Berchmans-College	Sint-Jan-Berchmanscollege	Antwerpen	1914-1918
EID239	1.0	Het Nieuws van den Dag	1902-11-05 00:00:00	"""eene voordracht met lichtbeelden geven over een ""Raid van 5500 kilometers in België, Luxemburg, Duitschland, Tyrolen, Italië, Sicilië en Frankrijk."""""	travel	Tyrol	België, Luxemburg, Duitsland, Oostenrijk, Italië, Sicilië, Frankrijk	Europa	CarniauxMichel Joseph Eugène	Katholieke Vlaamsche Hoogeschooluitbreiding	"""het lokaal"""	Extension université belge (section de Schaerbeek)	Brussel	1902-1904
EID2846	4.0	Het Vlaamsche Nieuws - Vlaamsche Gazet	1915-11-15 00:00:00	Italië	travel		Italië	Europa	De MeyPieter	Katholieke Vlaamsche Hoogeschooluitbreiding	groote zaal der St. Luitgardis-school	Sint-Lutgardisschool	Antwerpen	1914-1918
EID3344	1.0	Het Handelsblad	1922-12-29 00:00:00	de toekomst van Merksem	maatschappelijk		België	Europa	MennesFerdinandus	Katholieke Vlaamsche Hoogeschooluitbreiding	feestzaal Victoria	Feestzaal Victoria	Antwerpen	1922-1924
EID3496	2.0	Het Handelsblad	1922-02-03 00:00:00	Heropbouw van West-Vlaanderen	maatschappelijk		België	Europa	MéchantC.	Katholieke Vlaamsche Hoogeschooluitbreiding	St-Aloysius Patroonschap	Sint-Aloysius Patronaat	Antwerpen	1922-1924
EID3513	2.0	Het Handelsblad	1922-02-04 00:00:00	De Vaart Antwerpen Rijn	maatschappelijk		België	Europa	MennesFerdinandus	Katholieke Vlaamsche Hoogeschooluitbreiding	groote zaal van St Nobertus gesticht	Sint-Nobertusgesticht	Antwerpen	1922-1924
EID3831	1.0	Het Handelsblad	1922-03-17 00:00:00	Van Bombay naar het Himalaya-gebergte	travel		India	Azië	DierckxFrançois Petrus	Katholieke Vlaamsche Hoogeschooluitbreiding	St-Nobertusgesticht	Sint-Nobertusgesticht	Antwerpen	1922-1924
EID3958	1.0	De Standaard	1922-04-10 00:00:00	"""voordracht met eene reeks persoonlijke en oorspronkelijke lichtbeelden over ""Indië, land en volk"""""	travel		India	Azië	Quirinus	Katholieke Vlaamsche Hoogeschooluitbreiding	Volkslust		Rest	1922-1924
EID4029	1.0	De Standaard	1922-05-08 00:00:00	"""over ""Rome"", met lichtbeelden"""	travel	Rome	Italië	Europa	WalgraveJ.-B.	Katholieke Vlaamsche Hoogeschooluitbreiding	Volkslust		Rest	1922-1924
EID4114	1.0	De Standaard	1922-07-12 00:00:00	"""Over Belgisch-Congo"""	travel		Congo	Afrika	SiebenArthur	Katholieke Vlaamsche Hoogeschooluitbreiding			Rest	1922-1924
EID4268	3.0	De Standaard	1922-10-15 00:00:00	"""De Hawaï eilanden en het werk van Pater Damiaan"""	geschiedenis		Hawaï	Amerika	Van den Bossche Ignatius 	Katholieke Vlaamsche Hoogeschooluitbreiding			Rest	1922-1924
EID4279	1.0	Het Handelsblad	1922-10-28 00:00:00	het leven der muskieten en den strijd tegen de malaria in de Tropen	maatschappelijk		Congo	Afrika	Van OyeEugenius Josephus Marie	Katholieke Vlaamsche Hoogeschooluitbreiding	groote zaal van de stedelijke normaalschool voor jongens	Stedelijke Normaalschool	Antwerpen	1922-1924
EID4293	1.0	De Standaard	1922-11-05 00:00:00	"""ervaringen met het Belgisch expeditiekorps door China opgedaan"""	travel		China	Azië	LensJ.	Katholieke Vlaamsche Hoogeschooluitbreiding			Rest	1922-1924
EID4294	1.0	De Standaard	1922-10-15 00:00:00	"""Eene reis door Perzië"""	travel		Perzië	Azië	Maertens	Katholieke Vlaamsche Hoogeschooluitbreiding			Rest	1922-1924
EID4325	1.0	De Standaard	1922-10-15 00:00:00	"""Dwars door China, met het Belgisch expeditiekorps in 1918"""	travel		China	Azië	LensJ.	Katholieke Vlaamsche Hoogeschooluitbreiding			Rest	1922-1924
EID4347	1.0	Het Handelsblad	1922-11-11 00:00:00	Antwerpen grootstad	travel	Antwerpen	België	Europa	MennesFerdinandus	Katholieke Vlaamsche Hoogeschooluitbreiding	groote zaal van de stedelijke normaalschool voor jongens	Stedelijke Normaalschool	Antwerpen	1922-1924
EID4394	1.0	De Standaard	1922-11-19 00:00:00	"""Perzië"""	travel		Perzië	Azië	Maertens	Katholieke Vlaamsche Hoogeschooluitbreiding			Rest	1922-1924
EID4576	2.0	Het Laatste Nieuws	1922-12-08 00:00:00	Holland's grooten schilder Toorop	kunst		Nederland	Europa	Brom Gerard	Katholieke Vlaamsche Hoogeschooluitbreiding	Aula van de Hoogeschool		Rest	1922-1924
