ID EVENT uniek	E_aantal keer vermeld	Titel	DATUM KRANT	Onderwerp	Thema's_categorie	city	country	continent	spreker_samengevoegd	organisator1_gestandaardiseerd	Locatie	Locatie_gestandaardiseerd	STAD STANDAARD_GEGROEPEERD	period
EID4004	1.0	De Standaard	1922-04-21 00:00:00	"""hongersnood in Rusland"" ""conferenties met lichtbeelden"""	maatschappelijk		Rusland	Europa	Narischkine-WitteVéra	Rood Kruis van België			Rest	1922-1924
EID4006	1.0	De Standaard	1922-04-21 00:00:00	"""hongersnood in Rusland"" ""conferenties met lichtbeelden"""	maatschappelijk		Rusland	Europa	WautersArthur	Rood Kruis van België			Rest	1922-1924
EID5963	4.0	Journal De Bruxelles	1923-11-08 00:00:00	La Civilisation des Incas dans l'ancien Pérou	geschiedenis		Peru	Amerika	RoumaGeorges Ferdinand	Rood Kruis van België	l'école communale 	Ecole Communale n°1	Brussel	1922-1924
EID7965	1.0	De Standaard	1922-05-02 00:00:00	"""beweging ten gunste van de hongerlijdenden Russen heeft groote uitbreiding gekregen in den loop van de laatste maanden""  ""Geldinzamelingen in kerken en scholen zullen heel het land door worden gehouden. Een tentoonstelling van Russische kunst zal worden geopend. Voordrachten met lichtbeelden zullen in de beide landstalen gegeven worden"""	maatschappelijk		Rusland	Europa		Rood Kruis van België				1922-1924
EID4073	2.0	Le Drapeau Rouge	1922-05-20 00:00:00	"""Notre film sur la famine. Le film sur la Russie des Soviets et la famine que notre ""Comité de Secours Prolétarien"" met à la disposition de tous les groupements et syndicats ouvirers constitue un document inédit qui intéresse tous les travailleurs"" ""Une causerie explicative et commentaire aura lieu à mesure que le film se déroulera. Une série de projections lumineuses fixes montreront la situation actuelle dans les régions dévastées de la Volga"" "	maatschappelijk		Rusland	Europa		Secours Prolétarien			Rest	1922-1924
EID4079	2.0	Le Drapeau Rouge	1922-05-20 00:00:00	"""Notre film sur la famine. Le film sur la Russie des Soviets et la famine que notre ""Comité de Secours Prolétarien"" met à la disposition de tous les groupements et syndicats ouvirers constitue un document inédit qui intéresse tous les travailleurs"" ""Une causerie explicative et commentaire aura lieu à mesure que le film se déroulera. Une série de projections lumineuses fixes montreront la situation actuelle dans les régions dévastées de la Volga"" "	maatschappelijk		Rusland	Europa		Secours Prolétarien		Cinéma de la Rose Blanche	Brussel	1922-1924
EID4090	3.0	Le Drapeau Rouge	1922-05-20 00:00:00	"""Notre film sur la famine. Le film sur la Russie des Soviets et la famine que notre ""Comité de Secours Prolétarien"" met à la disposition de tous les groupements et syndicats ouvirers constitue un document inédit qui intéresse tous les travailleurs"" ""Une causerie explicative et commentaire aura lieu à mesure que le film se déroulera. Une série de projections lumineuses fixes montreront la situation actuelle dans les régions dévastées de la Volga"" "	maatschappelijk		Rusland	Europa		Secours Prolétarien			Rest	1922-1924
EID4107	2.0	Le Drapeau Rouge	1922-05-27 00:00:00	"""Le film sur la Russie des Soviets et la Famine que notre ""Comité de Secours Prolétarien"" met à la disposition de tous les groupements et syndicats ouvriers constitue un document inédit qui intéresse tous les travailleurs"" ""Une causerie explicative et commentaire aura lieu à mesure que le film se déroulera. Une série de projections lumineuses fixes montreront la situation actuelle dans les régions dévastées de la Volga"" "	maatschappelijk		Rusland	Europa		Secours Prolétarien			Rest	1922-1924
EID4116	2.0	Le Drapeau Rouge	1922-06-24 00:00:00	"""Le film sur la Russie des Soviets et la Famine que notre ""Comité de Secours Prolétarien"" met à la disposition de tous les groupements et syndicats ouvriers constitue un document inédit qui intéresse tous les travailleurs"" ""Une causerie explicative et commentaire aura lieu à mesure que le film se déroulera. Une série de projections lumineuses fixes montreront la situation actuelle dans les régions dévastées de la Volga"" "	maatschappelijk		Rusland	Europa		Secours Prolétarien	Cinéma de la Rose Blanche	Cinéma de la Rose Blanche	Brussel	1922-1924
EID4118	2.0	Le Drapeau Rouge	1922-07-08 00:00:00	"""Le film sur la Russie des Soviets et la Famine que notre ""Comité de Secours Prolétarien"" met à la disposition de tous les groupements et syndicats ouvriers constitue un document inédit qui intéresse tous les travailleurs"" ""Une causerie explicative et commentaire aura lieu à mesure que le film se déroulera. Une série de projections lumineuses fixes montreront la situation actuelle dans les régions dévastées de la Volga"" "	maatschappelijk		Rusland	Europa		Secours Prolétarien	Cinéma de la Rose Blanche		Rest	1922-1924
EID4121	2.0	Le Drapeau Rouge	1922-07-08 00:00:00	"""Le film sur la Russie des Soviets et la Famine que notre ""Comité de Secours Prolétarien"" met à la disposition de tous les groupements et syndicats ouvriers constitue un document inédit qui intéresse tous les travailleurs"" ""Une causerie explicative et commentaire aura lieu à mesure que le film se déroulera. Une série de projections lumineuses fixes montreront la situation actuelle dans les régions dévastées de la Volga"" "	maatschappelijk		Rusland	Europa		Secours Prolétarien	Cinéma de la Rose Blanche		Rest	1922-1924
EID4124	2.0	Le Drapeau Rouge	1922-07-08 00:00:00	"""Le film sur la Russie des Soviets et la Famine que notre ""Comité de Secours Prolétarien"" met à la disposition de tous les groupements et syndicats ouvriers constitue un document inédit qui intéresse tous les travailleurs"" ""Une causerie explicative et commentaire aura lieu à mesure que le film se déroulera. Une série de projections lumineuses fixes montreront la situation actuelle dans les régions dévastées de la Volga"" "	maatschappelijk		Rusland	Europa		Secours Prolétarien	Cinéma de la Rose Blanche		Rest	1922-1924
EID4126	1.0	Le Drapeau Rouge	1922-07-22 00:00:00	"""Le film sur la Russie des Soviets et la Famine que notre ""Comité de Secours Prolétarien"" met à la disposition de tous les groupements et syndicats ouvriers constitue un document inédit qui intéresse tous les travailleurs"" ""Une causerie explicative et commentaire aura lieu à mesure que le film se déroulera. Une série de projections lumineuses fixes montreront la situation actuelle dans les régions dévastées de la Volga"" "	maatschappelijk		Rusland	Europa		Secours Prolétarien	Salle Rubens 	Rubenspaleis 	Antwerpen	1922-1924
EID4137	1.0	Le Drapeau Rouge	1922-08-05 00:00:00	"""Le film sur la Russie des Soviets et la Famine que notre ""Comité de Secours Prolétarien"" met à la disposition de tous les groupements et syndicats ouvriers constitue un document inédit qui intéresse tous les travailleurs"" ""Une causerie explicative et commentaire aura lieu à mesure que le film se déroulera. Une série de projections lumineuses fixes montreront la situation actuelle dans les régions dévastées de la Volga"" "	maatschappelijk		Rusland	Europa		Secours Prolétarien			Rest	1922-1924
EID4138	1.0	Le Drapeau Rouge	1922-08-05 00:00:00	"""Le film sur la Russie des Soviets et la Famine que notre ""Comité de Secours Prolétarien"" met à la disposition de tous les groupements et syndicats ouvriers constitue un document inédit qui intéresse tous les travailleurs"" ""Une causerie explicative et commentaire aura lieu à mesure que le film se déroulera. Une série de projections lumineuses fixes montreront la situation actuelle dans les régions dévastées de la Volga"" "	maatschappelijk		Rusland	Europa		Secours Prolétarien	Bériot	Béroit	Brussel	1922-1924
EID1073	4.0	Le Peuple	1903-12-31 00:00:00	"""une conférence sur l'art hindou, avec projections lumineuses"""	kunst			Azië	CombazGisbert Corneel Henri Paul	Section d'Art de la Maison du Peuple	Maison du Peuple	Maison du Peuple	Brussel	1902-1904
EID1625	3.0	Le Peuple	1904-10-21 00:00:00	"""une conférence avec projections lumineuses sur les habitations ouvrières et les usines de Port Sunlight"" "	maatschappelijk		Engeland	Europa	DotheyLouis	Section d'Art de la Maison du Peuple	salle Blanche	Maison du Peuple	Brussel	1902-1904
EID1657	3.0	Le Peuple	1904-10-21 00:00:00	"""conférence: Impressions d'Amérique, avec projections lumineuses"""	travel		Verenigde Staten	Amerika	VanderveldeEmile Guillaume	Section d'Art de la Maison du Peuple	salle des fêtes de la Maison du Peuple	Maison du Peuple	Brussel	1902-1904
EID245	1.0	Le Peuple	1902-10-24 00:00:00	"""sa conférence La Sicile ancienne et moderne"" ""Elle sera illustrée par des projections lumineuses"""	travel		Sicilië	Europa	BulsCharles Gommaire François	Section d'Art de la Maison du Peuple	la Maison du Peuple de Bruxelles, dans la grande salle des fêtes	Maison du Peuple	Brussel	1902-1904
EID260	2.0	Le Peuple	1902-11-10 00:00:00	"""une conférence sur la Sicile ancienne et moderne. Cette conférence, accompagnée de projections lumineuses"""	travel		Sicilië	Europa	BulsCharles Gommaire François	Section d'Art de la Maison du Peuple	la salle des fêtes, à la Maison du Peuple	Maison du Peuple	Brussel	1902-1904
EID4209	3.0	Le Peuple	1922-10-12 00:00:00	Les hiéroglyphes égyptiens	geschiedenis		Egypte	Afrika	CapartJean François Désiré	Service Educatif des Musées royaux du Cinquantenaire		Service Educatif des Musées royaux du Cinquantenaire	Brussel	1922-1924
EID4846	1.0	Journal De Bruxelles	1923-02-02 00:00:00	La Belgique ancienne. Les premiers civilisés	geschiedenis		België	Europa		Service Educatif des Musées royaux du Cinquantenaire	Musées du Cinquantenaire	Institut d’art et d’archéologie	Brussel	1922-1924
EID5572	1.0	Journal De Bruxelles	1923-06-12 00:00:00	L'art bouddique	kunst			Azië	CombazGisbert Corneel Henri Paul	Service Educatif des Musées royaux du Cinquantenaire	Musée du Cinquantenaire	Institut d’art et d’archéologie	Brussel	1922-1924
EID5618	1.0	Journal De Bruxelles	1923-07-10 00:00:00	La sculpture chinoise	kunst		China	Azië	Spruyt	Service Educatif des Musées royaux du Cinquantenaire	Musées du Cinquantenaire	Institut d’art et d’archéologie	Brussel	1922-1924
EID7718	1.0	Journal De Bruxelles	1924-12-24 00:00:00	L'Art Byzantin	kunst			Europa	Lacoste	Service Educatif des Musées royaux du Cinquantenaire	Musée du Cinquantenaire	Institut d’art et d’archéologie	Brussel	1922-1924
EID8271	1.0	Journal De Bruxelles	1924-10-29 00:00:00	La conception égyptienne de la sculpture	kunst		Egypte	Afrika	LefrancqJ. 	Service Educatif des Musées royaux du Cinquantenaire	Musée du Cinquantenaire	Institut d’art et d’archéologie	Brussel	1922-1924
EID7205	3.0	Het Handelsblad	1924-10-01 00:00:00	zijn reis naar Budapest	maatschappelijk		Hongarije	Europa	PrimsFlorentinus Hubertus Ludovicus	Sint-Amandsparochie	lokaal der meisjespatronage	Meisjespatronage 	Antwerpen	1922-1924
EID7243	1.0	Het Handelsblad	1924-09-28 00:00:00	Rusland en het Bolsjevisme	maatschappelijk		Rusland	Europa	LensJ.	Sint-Augustinus' Werkmanskring 	bovenzaal van de Kring	Sint-Augustus Werkmanskring	Antwerpen	1922-1924
EID7561	1.0	Het Handelsblad	1924-09-28 00:00:00	Hongarië	maatschappelijk		Hongarije	Europa	PrimsFlorentinus Hubertus Ludovicus	Sint-Augustinus' Werkmanskring 	bovenzaal van de Kring	Sint-Augustus Werkmanskring	Antwerpen	1922-1924
EID7723	1.0	Het Handelsblad	1924-09-28 00:00:00	Het H. Land (als voorbeelding tot Kerstmis)	travel		het Heilige Land	Azië	Creten	Sint-Augustinus' Werkmanskring 	bovenzaal van de Kring	Sint-Augustus Werkmanskring	Antwerpen	1922-1924
EID2279	1.0	Het Handelsblad	1914-03-12 00:00:00	De provincie Quebec	travel	Québec	Canada	Amerika	CornezPaul 	Sint-Ignatius Hoogere Handelsschool	de Academizaal Hoogere Handelschool van het St-Ignatiusgesticht	Sint-Ignatius Hoogere Handelsschool	Antwerpen	1914-1918
EID6058	1.0	Het Handelsblad	1923-11-17 00:00:00	La Cochinchine, le Cambodge et les ruïnes d'Angkor	travel	Angkor	Vietnam, Cambodja	Azië	Renaux de BoubersP.	Sint-Ignatius Hoogere Handelsschool	St-Ignatius' Hoogere Handelsschool	Sint-Ignatius Hoogere Handelsschool	Antwerpen	1922-1924
EID1285	3.0	Het Handelsblad	1904-02-25 00:00:00	Italië	travel		Italië	Europa	De MeyPieter	Sint-Vincentiusgenootschap	lokaal van den Katholieken Werkmanskring	Katholieken Werkmanskring	Antwerpen	1902-1904
EID1695	1.0	Het Nieuws van den Dag	1904-11-19 00:00:00	"""zijn reis naar het H. Land en Jerusalem vertellen en toonen met lichtbeelden"""	travel	Jerusalem	het Heilige Land	Azië	Ferrant	Sint-Vincentiusgenootschap	Werkmanskring		Rest	1902-1904
EID2233	2.0	Journal De Bruxelles	1914-03-02 00:00:00	les temples japonais et leurs trésors	travel		Japan	Azië	SegaertHenri	"Société ""Les arts de l'Extrême-Orient"""	Salle Patria	Patria	Brussel	1914-1918
EID3316	7.0	La Libre Belgique	1918-12-06 00:00:00	Traitement des plaies de guerre dans les ambulances du front	maatschappelijk			Europa	Depage	Société belge de chirurgie	la salle gothique de l'Hôtel de Ville	Stadshuis	Brussel	1914-1918
EID160	1.0	L'Indépendance Belge	1902-05-24 00:00:00	les souvenirs de voyage d'un électricien en Amérique	travel		Verenigde Staten	Amerika	GillonGustave	Société belge d'electriciens	Hôtel Ravenstein	Hôtel Ravenstein	Brussel	1902-1904
EID8419	1.0	Journal De Bruxelles	1902-01-24 00:00:00	les chemins de fer électriques en Amérique, en Suisse et en Allemagne	wetenschap		Verenigde Staten, Zwitserland, Duitsland	Amerika, Europa		Société belge d'electriciens		Société Scientifique de Bruxelles	Brussel	1902-1904
EID7359	4.0	De Nieuwe Gazet	1924-11-12 00:00:00	Het psychotechnische onderzoek voor de werving van personeel	maatschappelijk			Amerika	de LannoyFauconnier	Société belge d'électriciens		Hôtel Ravenstein	Brussel	1922-1924
EID1129	1.0	Le Soir	1904-01-18 00:00:00	"""conférence avec projections lumineuses"" """"La Corse"""""	travel		Corsica	Europa	BulsCharles Gommaire François	Société belge des Ingénieurs et des Industriels	Hôtel Métropole	Hôtel Métropole	Brussel	1902-1904
EID1309	1.0	Le Soir	1904-03-02 00:00:00	"""conférence avec projections lumineuses"" """"Le canal de Panama"""""	maatschappelijk			Amerika	LiebrechtDéodat	Société belge des Ingénieurs et des Industriels	Hotel Ravenstein	Hôtel Ravenstein	Brussel	1902-1904
EID1403	1.0	Le Soir	1904-03-26 00:00:00	"""conférence avec projections lumineuses"" """"L'art Hindou"""""	kunst			Azië	CombazGisbert Corneel Henri Paul	Société belge des Ingénieurs et des Industriels	Hotel Ravenstein	Hôtel Ravenstein	Brussel	1902-1904
EID1417	2.0	Le Soir	1904-04-02 00:00:00	"""conférence avec projections lumineuses"" """"Le Pérou et l'Amérique Latine"""""	travel		Peru	Amerika	Van Hoorde	Société belge des Ingénieurs et des Industriels	Hotel Ravenstein	Hôtel Ravenstein	Brussel	1902-1904
EID143	1.0	L'Indépendance Belge	1902-05-09 00:00:00	le nouveau bassin houiller du Limbourg	maatschappelijk		België	Europa	HarzéPaul Émile Casimir	Société belge des Ingénieurs et des Industriels	la Société belge des ingénieurs et industriels	Hôtel Ravenstein	Brussel	1902-1904
EID1453	1.0	Le Soir	1904-04-16 00:00:00	"""conférence avec projections lumineuses"" """"Vieux Bruxelles et vieilles légendes bruxelloises"""" bruxelloises"	travel	Brussel	België	Europa	NinauveFrédéric Auguste Joseph	Société belge des Ingénieurs et des Industriels	Hotel Ravenstein	Hôtel Ravenstein	Brussel	1902-1904
EID1467	1.0	Le Soir	1904-04-20 00:00:00	"""conférence avec projections lumineuses"" """"Un voyage aux pays des Balkans"""""	travel		Balkan	Europa	de LevalCharles Gaston	Société belge des Ingénieurs et des Industriels	Hotel Ravenstein	Hôtel Ravenstein	Brussel	1902-1904
EID1478	1.0	Le Soir	1904-04-27 00:00:00	"""conférence avec projections lumineuses"" """"La fabrication des chaînes sans soudure par le procedé belge du laminage annulaire"""""	wetenschap		België	Europa	FrancoisEugène	Société belge des Ingénieurs et des Industriels	Hotel Ravenstein	Hôtel Ravenstein	Brussel	1902-1904
EID2304	4.0	Le Peuple	1914-03-16 00:00:00	le canal maritime de Bruxelles au Rupel	maatschappelijk		België	Europa	LaneauH.-A.	Société belge des Ingénieurs et des Industriels	le grand auditoire de physique de l'Université de Bruxelles	Université de Bruxelles	Brussel	1914-1918
EID237	1.0	Het Laatste Nieuws	1902-11-17 00:00:00	Sicilië	travel		Sicilië	Europa	BulsCharles Gommaire François	Société belge des Ingénieurs et des Industriels	Hotel Metropole (groote zaal)	Hôtel Métropole	Brussel	1902-1904
EID5016	1.0	Le Peuple	1923-02-13 00:00:00	L'Embouteillage de Zeeruge (23 avril 1918) Quelques mots sur l'avenier de notre grand port	maatschappelijk		België	Europa	StinglhamberG	Société belge des Ingénieurs et des Industriels	Grand auditoire de physique de l'Université libre de Bruxelles	Université de Bruxelles	Brussel	1922-1924
EID5319	1.0	Le Peuple	1923-03-21 00:00:00	Les grands travaux d'Anvers	maatschappelijk		België	Europa	BonnetL.	Société belge des Ingénieurs et des Industriels	Hôtel Ravenstein	Hôtel Ravenstein	Brussel	1922-1924
EID6068	7.0	Le Soir	1923-11-12 00:00:00	"""Le tremblement de terre du Japon (1er septembre 1923)"""	wetenschap		Japan	Azië	DierckxFrançois Petrus	Société belge des Ingénieurs et des Industriels	Union Coloniale	Union Coloniale	Brussel	1922-1924
EID619	1.0	Le Soir	1903-03-28 00:00:00	"""Un voyage en Croatie, Dalmatie, Bosnie et Herzègovina"""	travel		Kroatië, Dalmatië, Bosnië en Herzegovina	Europa	CarniauxMichel Joseph Eugène	Société belge des Ingénieurs et des Industriels	salle de l'Hotel Ravenstein	Hôtel Ravenstein	Brussel	1902-1904
EID6397	3.0	Journal De Bruxelles	1924-01-10 00:00:00	La Campine industrielle	maatschappelijk			Europa	HenriquetMaurice	Société belge des Ingénieurs et des Industriels	au local, Hôtel Ravenstein	Hôtel Ravenstein	Brussel	1922-1924
EID6716	1.0	Le Soir	1924-02-27 00:00:00	"""L'industrie du fer au Grand-Duché de Luxembourg"" "	maatschappelijk		Luxemburg	Europa	CalmesA.	Société belge des Ingénieurs et des Industriels	Hotel Ravenstein	Hôtel Ravenstein	Brussel	1922-1924
EID7722	1.0	Journal De Bruxelles	1924-12-24 00:00:00	Congo	travel		Congo	Afrika	Carton de WiartHenri Victor Marie Ghislain graaf	Société belge des Ingénieurs et des Industriels	Palais des Académies 	Palais des Académies 	Brussel	1922-1924
EID5873	1.0	Journal De Bruxelles	1923-10-30 00:00:00	La Protection des indigènes au Congo	maatschappelijk		Congo	Afrika	DellicourFernand	Société belge d'Etudes et d'Exposition	Société Belge d'Etudes et d'Exposition		Rest	1922-1924
EID6222	1.0	Le Soir	1923-12-10 00:00:00	"""A travers les Tatras"""	travel			Europa	FichefetJules	Société belge pour l'amélioration du sort de la femme		Foyer de la Femme	Brussel	1922-1924
EID1102	1.0	Journal De Bruxelles	1904-01-15 00:00:00	la colonisation agricole en Malaisie	maatschappelijk		Maleisië	Azië	ColletOctave	Société Centrale d'agriculture	Société Centrale d'agriculture	Société Centrale d'agriculture 	Brussel	1902-1904
EID1781	2.0	Le Soir	1904-12-10 00:00:00	"""L'architecture aux Etats-Unis d'Amerique"""	kunst		Verenigde Staten	Amerika	SaintenoyPaul Pierre Jean	Société Centrale d'architecture de Belgique	la salle du fêtes du Palais de la Bourse	Palais de la Bourse 	Brussel	1902-1904
EID5785	2.0	Journal De Bruxelles	1923-10-13 00:00:00	La Château de Rixensart en la Renaissance	geschiedenis		België	Europa	MoenaertRaymond	Société Centrale d'architecture de Belgique	la grande salle de l'Hôtel Ravenstein	Hôtel Ravenstein	Brussel	1922-1924
EID6486	1.0	Journal De Bruxelles	1924-01-24 00:00:00	Le Jardin belge de demain	maatschappelijk		België	Europa	BuyssensJules Alphonse César	Société Centrale d'architecture de Belgique	la grande salle de l'Hotel Ravenstein	Hôtel Ravenstein	Brussel	1922-1924
EID1516	1.0	Le Soir	1904-05-11 00:00:00	"""conférence avec projections lumineuses"" """"Les Forêts de Thiérache"""""	travel	Ardennen	Frankrijk	Europa	LegrosA.	Société centrale forestière de Belgique		Caves de Maastricht	Brussel	1902-1904
EID2351	2.0	Le Peuple	1914-03-23 00:00:00	Les boisements en Campine	travel	Kempen	België	Europa	Durieux	Société centrale forestière de Belgique	Caves de Maastricht	Caves de Maastricht	Brussel	1914-1918
EID3764	3.0	Le Soir	1922-03-06 00:00:00	"""propose d'ériger une vaste cité-jardin sur un terrain merveilleusement situé qu'elle vient d'acquérir à Woluwe-Saint-Lambert"" "	maatschappelijk		België	Europa		"Société coopérative de la ""Cité"""	la salle du Lion D'or	Salle du 'Lion d'Or'	Brussel	1922-1924
EID2514	1.0	Le Peuple	1914-04-24 00:00:00	Les origines de la civilisation égyptienne	geschiedenis		Egypte	Afrika	CapartJean François Désiré	Société d'anthropologie	Université libre de Bruxelles (grand auditoire de physique)	Université de Bruxelles	Brussel	1914-1918
EID5879	1.0	Le Soir	1923-10-26 00:00:00	"""La civilisation des Incas et leur communisme autocratique"""	geschiedenis		Peru	Amerika	RoumaGeorges Ferdinand	Société d'anthropologie de Bruxelles	Grand auditoire de physique de l'Université libre	Université de Bruxelles	Brussel	1922-1924
EID5520	2.0	Le Soir	1923-05-03 00:00:00	"""Le tombeau de  Tout-Ank-Ahmon"""	geschiedenis		Egypte	Afrika	CapartJean François Désiré	Société d'Archéologie	l'Union coloniale	Union Coloniale	Brussel	1922-1924
EID8174	1.0	L'Indépendance Belge	1924-05-11 00:00:00	les fouilles qu'il a faites à Salinijeh, l'antique Doura, dans le désert de Syrie	geschiedenis		Syrië	Azië	CumontGeorges	Société d'Archéologie	la Société royale d'Archéologie	Société d'archéologie	Brussel	1922-1924
EID8261	1.0	Journal De Bruxelles	1902-01-19 00:00:00	catacombes, les premiers chrétiens, leurs costumes et leurs moeurs	geschiedenis			Europa	KanzlerRodolfo baron	Société d'Archéologie	Société d'archéologie	Société d'archéologie	Brussel	1902-1904
EID856	3.0	Le Soir 	1903-09-28 00:00:00	"""conférence avec projections"" ""Timgrad, une ville africaine sous la domination de l'Empire Romaine"	travel	Timgrad	Algerije	Afrika	WinckelmansGustave	Société d'Archéologie		Société d'archéologie	Brussel	1902-1904
EID8161	1.0	L'Indépendance Belge	1914-01-09 00:00:00	des métamorphoses subies par le village de Haren, où l'indusrtie s'est développée, au point que la villegiature y est devenue impossible	maatschappelijk		Nederland	Europa	CosynArthur	Société d'Archéologie 		Société d'archéologie	Brussel	1914-1918
EID8214	2.0	Journal De Bruxelles	1914-02-05 00:00:00	l'histoire de l'art dans le Brabant	kunst		België	Europa	DestréeJoseph 	Société d'Archéologie 		Société d'archéologie	Brussel	1914-1918
EID8242	4.0	Journal De Bruxelles	1914-03-05 00:00:00	des vieilles habitations rurales de chez nous	travel		België	Europa	HeinsA.	Société d'Archéologie 		Société d'archéologie	Brussel	1914-1918
EID8272	4.0	Journal De Bruxelles	1914-04-09 00:00:00	L'architecture dans le tableaux des Primitifs flamands	kunst		België	Europa	LemaireR.	Société d'Archéologie 	Société royale d'archeologie	Société d'archéologie	Brussel	1914-1918
EID2507	4.0	Le Peuple	1914-04-24 00:00:00	L'Algérie météoriolique et climatogique. Phénomènes de l'atomsphère.	wetenschap		Algerije	Afrika	BoutquinA. 	Société d'Astronomie	Patria	Patria	Brussel	1914-1918
EID4001	2.0	Het Handelsblad	1922-04-27 00:00:00	"Une visite à l'Observatoire d'une grande université américaine, l'Oberservatoire Lick en Californie"""	travel	Californië	Verenigde Staten	Amerika	ScouvartAlice Julie Mélanie Jeanne	Société d'Astronomie	Feestzaal van het Koninklijk Atheneum 	Koninklijk Atheneum	Antwerpen	1922-1924
EID3758	1.0	Journal De Bruxelles	1922-03-07 00:00:00	Ce que j'ai vu en Russie	travel		Rusland	Europa	Parîs	Société de Saint-Vincent-de-Paul	la salle de l'Union Coloniale	Union Coloniale	Brussel	1922-1924
EID4007	1.0	Le Soir	1922-04-29 00:00:00	"""""Le Congo et son avenir"", avec projections lumineuses et cinématographiques"" "	maatschappelijk		Congo	Afrika	LaudeNorbert	Société des Anciens Militaires de l'Armée belge	salle Luppens	salle Luppens	Brussel	1922-1924
EID1019	2.0	Journal De Bruxelles	1903-12-14 00:00:00	Les Etats fédérés Malais en 1903	maatschappelijk		Maleisië	Azië	ColletOctave	Société d'études coloniales	hôtel Ravenstein	Hôtel Ravenstein	Brussel	1902-1904
EID1204	3.0	Le Nouveau Précurseur	1904-02-02 00:00:00	"""l'étude de la constitu-juridique de l'Etat du Congo"""	maatschappelijk		Congo	Afrika	DuboisMarie Mathieu Joseph Auguste Ernest	Société d'études coloniales	"""à l'Institut supérieur de commerce"""	Hoger Handelsgesticht 	Antwerpen	1902-1904
EID1208	1.0	Le Soir	1904-02-05 00:00:00	"""conférence avec projections lumineuses"" """"Exploration de la Bahia Negra et voyage dans la Bolivie Orientale"""""	travel		Paraguay, Bolivia	Amerika	ColbrantHenri	Société d'études coloniales	Hôtel Ravenstein	Hôtel Ravenstein	Brussel	1902-1904
EID1220	2.0	Le Nouveau Précurseur	1904-02-11 00:00:00	"""La constitution juridique de l'Etat du Congo"""	maatschappelijk		Congo	Afrika	DuboisMarie Mathieu Joseph Auguste Ernest	Société d'études coloniales	"""Institut supérieur de commerce"""	Hoger Handelsgesticht 	Antwerpen	1902-1904
EID1256	1.0	Le Soir	1904-02-19 00:00:00	"""conférence avec projections lumineuses"" """"La Corée économique"""""	travel		Korea	Azië	de BrayA. -J. 	Société d'études coloniales	Hotel Ravenstein	Hôtel Ravenstein	Brussel	1902-1904
EID1306	1.0	L'Indépendance Belge	1904-03-06 00:00:00	le Nippon	travel		Japan	Azië	GollierThéophile François Joseph	Société d'études coloniales	Société d'études des coloniales	Hôtel Ravenstein	Brussel	1902-1904
